{
  "schemaVersion": "brain.review-decision/1",
  "decisionId": "rd_0001",
  "candidateId": "cand_0002",
  "decision": "edit",
  "reviewer": {
    "kind": "direct_user",
    "id": "user_fixture01"
  },
  "decidedAt": "2026-09-24T18:00:00Z",
  "editedClaim": "The user prefers short weather summaries on weekdays.",
  "labels": {
    "integrity": "direct_user",
    "confidentiality": "private"
  }
}
